{
  "$schema": "https://raw.githubusercontent.com/wilanis/wilanis-js/main/packages/core/schemas/binding.schema.json",
  "label": "REST storage",
  "description": "monitor.port.json over the REST API: one data graph per operation, each a declared request plus the decision of what its status means.",
  "port": "@monitor/domain/monitor.port.json",
  "operations": {
    "listAll": {
      "graph": "@monitor/data/list-rows.graph.json"
    },
    "listByMethod": {
      "graph": "@monitor/data/list-rows-by-method.graph.json"
    },
    "get": {
      "graph": "@monitor/data/get-row.graph.json"
    },
    "record": {
      "graph": "@monitor/data/create-row.graph.json"
    },
    "update": {
      "graph": "@monitor/data/update-row.graph.json"
    },
    "remove": {
      "graph": "@monitor/data/delete-row.graph.json"
    },
    "removeMany": {
      "description": "The business graph that fans one removal out per id and waits for all of them.",
      "graph": "@monitor/domain/remove-entries.graph.json"
    },
    "submit": {
      "description": "The business graph that attributes and records.",
      "graph": "@monitor/domain/record-entry.graph.json"
    },
    "recordAll": {
      "description": "The business graph that records each draft. Nothing here says they move together: an upstream API is not something a transaction can roll back.",
      "graph": "@monitor/domain/record-each.graph.json"
    },
    "list": {
      "description": "The business graph that routes on the filter.",
      "graph": "@monitor/domain/list-entries.graph.json"
    },
    "digest": {
      "description": "The business graph that composes the digest.",
      "graph": "@monitor/domain/digest.graph.json"
    },
    "parseDrafts": {
      "graph": "@monitor/data/parse-drafts.graph.json"
    },
    "toCsv": {
      "graph": "@monitor/data/write-csv.graph.json"
    },
    "import": {
      "description": "The business graph that reads the file and submits each row.",
      "graph": "@monitor/domain/import-entries.graph.json"
    },
    "export": {
      "description": "The business graph that lists and writes the file.",
      "graph": "@monitor/domain/export-entries.graph.json"
    },
    "prepare": {
      "description": "Reading the collection once is what readiness means for an upstream API: there is nothing to create, and a tree that cannot reach it refuses to serve.",
      "run": "@http/http.port.json#request",
      "in": {
        "connection": "@connections/monitor-api.connection.json",
        "method": "GET",
        "path": "/monitor",
        "produces": "application/json"
      }
    }
  }
}
