{
  "$schema": "https://raw.githubusercontent.com/wilanis/wilanis-js/main/packages/core/schemas/binding.schema.json",
  "label": "Customers over a store",
  "description": "How the customer port is met when the customers are kept rather than fetched: the six data graphs read and write one collection through @storage, and the business graphs are the same ones the REST binding uses -- which is the point of a port.",
  "port": "@customers/domain/customer.port.json",
  "operations": {
    "listAll": {
      "graph": "@customers/data/kept-list.graph.json"
    },
    "listByTier": {
      "graph": "@customers/data/kept-list-by-tier.graph.json"
    },
    "get": {
      "graph": "@customers/data/kept-get.graph.json"
    },
    "register": {
      "description": "The data graph that stores the customer and its method’s latest as one transaction.",
      "graph": "@customers/data/store-and-latest.graph.json"
    },
    "update": {
      "graph": "@customers/data/kept-update.graph.json"
    },
    "remove": {
      "graph": "@customers/data/kept-remove.graph.json"
    },
    "removeMany": {
      "description": "The business graph that fans one removal out per id and waits for all of them.",
      "graph": "@customers/domain/remove-customers.graph.json"
    },
    "submit": {
      "description": "The business graph that attributes and records.",
      "graph": "@customers/domain/register-customer.graph.json"
    },
    "registerAll": {
      "description": "The business graph that records the batch as one transaction: every draft or none.",
      "graph": "@customers/domain/register-all.graph.json"
    },
    "list": {
      "description": "The business graph that routes on the filter.",
      "graph": "@customers/domain/list-customers.graph.json"
    },
    "digest": {
      "description": "The business graph that composes the digest.",
      "graph": "@customers/domain/digest.graph.json"
    },
    "parseDrafts": {
      "graph": "@customers/data/parse-drafts.graph.json"
    },
    "toCsv": {
      "graph": "@customers/data/write-csv.graph.json"
    },
    "import": {
      "description": "The business graph that reads the file and submits each row.",
      "graph": "@customers/domain/import-customers.graph.json"
    },
    "export": {
      "description": "The business graph that lists and writes the file.",
      "graph": "@customers/domain/export-customers.graph.json"
    },
    "prepare": {
      "description": "Create the collections the store declares, and leave alone any that are there. The startup step names this operation, so what a tree prepares is what its project.json says it prepares.",
      "run": "@storage/storage.port.json#ensure",
      "in": {
        "store": "@customers/data/customers.store.json"
      }
    }
  }
}
